{
  "ShipperName": "ABC TRADING CO., LTD.",
  "ShipperAddr": "ADD: NO.1 ROAD, SHENZHEN, CHINA\nTEL: +86 755 12345678\nFAX: 0755-88889999\nEMAIL: ops@example.com",
  "ShipperTel": "+86 755 12345678",
  "ShipperEmail": "ops@example.com",
  "ShipperFax": "0755-88889999",
  "ConsigneeName": "XYZ IMPORT PTY LTD",
  "ConsigneeAddr": "100 TEST STREET, MELBOURNE\nEMAIL: import@example.com",
  "ConsigneeTel": "",
  "ConsigneeEmail": "import@example.com",
  "ConsigneeFax": "",
  "NotifyName": "SAME AS CONSIGNEE",
  "NotifyAddr": "TEL: +61 3 9000 0000",
  "NotifyTel": "+61 3 9000 0000",
  "NotifyEmail": "",
  "NotifyFax": "",
  "POR": "",
  "PORName": "",
  "POL": "",
  "POLName": "YANTIAN",
  "POD": "",
  "PODName": "MELBOURNE",
  "TransPort": "",
  "DeliveryCode": "",
  "DeliveryName": "",
  "ETD": "2023/8/11",
  "ETA": "",
  "Vessel": "KOTA TEST",
  "Voyage": "001S",
  "CutOffDate": "",
  "SICutOff": "",
  "ContainerInfo": [
    {
      "ContainerNo": "ABCU1234567",
      "SealNo": "SEAL123",
      "ContSize": "40",
      "ContType": "HQ",
      "KGS": "9170.000",
      "KGSunit": "KGS",
      "PCS": "501",
      "Package": "PAG",
      "CBM": "68.000",
      "CBMunit": "CBM",
      "HSCode": "3924900000",
      "GoodsName": "DAILY NECESSITIES",
      "GoodsNameCN": "日用品"
    }
  ],
  "TotalContainerQty": "",
  "GoodsName": "DAILY NECESSITIES",
  "GoodsNameCN": "日用品",
  "Marks": "",
  "HSCode": "3924900000",
  "Packages": "501",
  "PackagesUnit": "PAG",
  "GrossWeight": "9170.000",
  "GrossWeightUnit": "KGS",
  "NetWeight": "",
  "NetWeightUnit": "",
  "Volume": "68.000",
  "VolumeUnit": "CBM",
  "Incoterms": "",
  "Movement": "",
  "PackingMode": "",
  "GoodsType": "S",
  "FreightTerm": "",
  "Carrier": "",
  "IsTrucking": "",
  "IsCustomsDeclare": "",
  "ReleaseBLType": "",
  "BookingNo": "BK123456",
  "BLNo": "",
  "ContractNo": "",
  "Remark": ""
}