{
  "ShipperName": "",
  "ShipperAddr": "",
  "ShipperTel": "",
  "ShipperEmail": "",
  "ShipperFax": "",
  "ConsigneeName": "",
  "ConsigneeAddr": "",
  "ConsigneeTel": "",
  "ConsigneeEmail": "",
  "ConsigneeFax": "",
  "NotifyName": "",
  "NotifyAddr": "",
  "NotifyTel": "",
  "NotifyEmail": "",
  "NotifyFax": "",
  "POR": "",
  "PORName": "",
  "POL": "",
  "POLName": "",
  "POD": "",
  "PODName": "",
  "TransPort": "",
  "DeliveryCode": "",
  "DeliveryName": "",
  "ETD": "",
  "ETA": "",
  "Vessel": "",
  "Voyage": "",
  "CutOffDate": "",
  "SICutOff": "",
  "ContainerInfo": [],
  "TotalContainerQty": "",
  "GoodsName": "",
  "GoodsNameCN": "",
  "Marks": "",
  "HSCode": "",
  "Packages": "",
  "PackagesUnit": "",
  "GrossWeight": "",
  "GrossWeightUnit": "",
  "NetWeight": "",
  "NetWeightUnit": "",
  "Volume": "",
  "VolumeUnit": "",
  "Incoterms": "",
  "Movement": "",
  "PackingMode": "",
  "GoodsType": "S",
  "FreightTerm": "",
  "Carrier": "",
  "IsTrucking": "",
  "IsCustomsDeclare": "",
  "ReleaseBLType": "",
  "BookingNo": "",
  "BLNo": "",
  "ContractNo": "",
  "Remark": ""
}
